{
  "project_id": "project-cn-hold-001",
  "source_family": "ggzy_national",
  "region_code": "CN-340100",
  "project_name": "Hold Incomplete Chain Project",
  "project_type_raw": "highway",
  "engineering_domain": "transportation",
  "bid_control_price": 32000000,
  "bid_eval_method": "comprehensive",
  "public_chain_status": "INCOMPLETE",
  "opening_record_count": 0,
  "invalid_bid_count": 0
}
